{"$schema":"https://json-schema.org/draft/2020-12/schema","$id":"https://fde-agent-platform.dev/contracts/workflow-spec/v1","title":"WorkflowSpec","type":"object","additionalProperties":false,"required":["schema","workflow_spec_id","version","tenant_ref","state","generated_at","source_subjects","trigger","states","transitions","controlled_cycles","rollback","reconciliation","release_gates","workflow_digest","execution_authority","production_admission"],"properties":{"schema":{"const":"fde-agent/workflow-spec/v1"},"workflow_spec_id":{"type":"string","pattern":"^[a-z][a-z0-9-]{2,95}$"},"version":{"type":"string","pattern":"^\\d+\\.\\d+\\.\\d+$"},"tenant_ref":{"type":"string","minLength":1},"state":{"enum":["DRAFT","VALIDATED","COMPILED","REFUSED"]},"generated_at":{"type":"string","format":"date-time"},"source_subjects":{"type":"object","additionalProperties":false,"required":["process_twin_digest","context_pack_digest","digital_employee_spec_digest","policy_subjects","policy_request_digests","policy_decision_digests","connector_capability_digests","eval_pack_subjects","model_profile_subject"],"properties":{"process_twin_digest":{"type":"string","pattern":"^[a-f0-9]{64}$"},"context_pack_digest":{"type":"string","pattern":"^[a-f0-9]{64}$"},"digital_employee_spec_digest":{"type":"string","pattern":"^[a-f0-9]{64}$"},"policy_subjects":{"type":"array","minItems":1,"uniqueItems":true,"items":{"type":"string","minLength":1}},"policy_request_digests":{"type":"array","minItems":1,"uniqueItems":true,"items":{"type":"string","pattern":"^[a-f0-9]{64}$"}},"policy_decision_digests":{"type":"array","minItems":1,"uniqueItems":true,"items":{"type":"string","pattern":"^[a-f0-9]{64}$"}},"connector_capability_digests":{"type":"array","minItems":1,"uniqueItems":true,"items":{"type":"string","pattern":"^[a-f0-9]{64}$"}},"eval_pack_subjects":{"type":"array","minItems":1,"uniqueItems":true,"items":{"type":"string","minLength":1}},"model_profile_subject":{"type":"string","minLength":1}}},"trigger":{"type":"object","additionalProperties":false,"required":["trigger_id","type","source","event_type","deduplication_key_template"],"properties":{"trigger_id":{"type":"string","pattern":"^[a-z][a-z0-9-]{2,95}$"},"type":{"enum":["EVENT","MANUAL","SCHEDULE"]},"source":{"type":"string","minLength":1},"event_type":{"type":["string","null"]},"deduplication_key_template":{"type":"string","minLength":1}}},"states":{"type":"array","minItems":3,"items":{"type":"object","additionalProperties":false,"required":["state_id","kind","owner_role","terminal"],"properties":{"state_id":{"type":"string","pattern":"^[a-z][a-z0-9-]{2,95}$"},"kind":{"enum":["INITIAL","ACTIVE","HUMAN_WAIT","RECONCILING","COMPENSATING","TERMINAL_SUCCESS","TERMINAL_FAILURE"]},"owner_role":{"type":"string","minLength":1},"terminal":{"type":"boolean"}}}},"transitions":{"type":"array","minItems":1,"items":{"type":"object","additionalProperties":false,"required":["transition_id","from","to","executor_class","action_id","operation_id","operation_identity_template","capability_digest","action_class","preconditions","postconditions","allowed_tool_ids","prohibited_tool_ids","policy_subjects","required_evidence_subjects","model_responsibilities","approval","retry","timeout_seconds","postcondition_observer_operation_id","compensation_transition_id","escalation_role","on_unknown_completion"],"properties":{"transition_id":{"type":"string","pattern":"^[a-z][a-z0-9-]{2,95}$"},"from":{"type":"string","minLength":1},"to":{"type":"string","minLength":1},"executor_class":{"enum":["DETERMINISTIC","MODEL","HUMAN","CONNECTOR"]},"action_id":{"type":["string","null"]},"operation_id":{"type":["string","null"]},"operation_identity_template":{"type":["string","null"]},"capability_digest":{"type":["string","null"]},"action_class":{"enum":["NONE","READ","RECOMMEND","DRAFT","REVERSIBLE_ACTION","APPROVED_COMMIT","PROHIBITED"]},"preconditions":{"type":"array","minItems":1,"uniqueItems":true,"items":{"type":"string","minLength":1}},"postconditions":{"type":"array","minItems":1,"uniqueItems":true,"items":{"type":"string","minLength":1}},"allowed_tool_ids":{"type":"array","uniqueItems":true,"items":{"type":"string","pattern":"^[a-z][a-z0-9.-]{2,127}$"}},"prohibited_tool_ids":{"type":"array","uniqueItems":true,"items":{"type":"string","pattern":"^[a-z][a-z0-9.-]{2,127}$"}},"policy_subjects":{"type":"array","uniqueItems":true,"items":{"type":"string","minLength":1}},"required_evidence_subjects":{"type":"array","minItems":1,"uniqueItems":true,"items":{"type":"string","minLength":1}},"model_responsibilities":{"type":"array","uniqueItems":true,"items":{"enum":["CLASSIFY","EXTRACT","SUMMARIZE","RECOMMEND"]}},"approval":{"type":"object","additionalProperties":false,"required":["mode","required_roles","expires_after_seconds"],"properties":{"mode":{"enum":["NEVER","CONDITIONAL","ALWAYS"]},"required_roles":{"type":"array","uniqueItems":true,"items":{"type":"string","minLength":1}},"expires_after_seconds":{"type":["integer","null"],"minimum":1}}},"retry":{"type":"object","additionalProperties":false,"required":["max_attempts","backoff_seconds","requires_idempotency"],"properties":{"max_attempts":{"type":"integer","minimum":1,"maximum":5},"backoff_seconds":{"type":"integer","minimum":0,"maximum":3600},"requires_idempotency":{"type":"boolean"}}},"timeout_seconds":{"type":"integer","minimum":1,"maximum":86400},"postcondition_observer_operation_id":{"type":["string","null"]},"compensation_transition_id":{"type":["string","null"]},"escalation_role":{"type":["string","null"]},"on_unknown_completion":{"enum":["NOT_APPLICABLE","RECONCILE","FREEZE"]}}}},"controlled_cycles":{"type":"array","items":{"type":"object","additionalProperties":false,"required":["cycle_id","transition_ids","max_iterations","timeout_seconds","exit_condition"],"properties":{"cycle_id":{"type":"string","pattern":"^[a-z][a-z0-9-]{2,95}$"},"transition_ids":{"type":"array","minItems":2,"uniqueItems":true,"items":{"type":"string","minLength":1}},"max_iterations":{"type":"integer","minimum":1,"maximum":100},"timeout_seconds":{"type":"integer","minimum":1,"maximum":86400},"exit_condition":{"type":"string","minLength":1}}}},"rollback":{"type":"object","additionalProperties":false,"required":["strategy","entry_transition_id","trigger_conditions"],"properties":{"strategy":{"enum":["COMPENSATE","RESTORE_SNAPSHOT","HUMAN_ONLY","NONE"]},"entry_transition_id":{"type":["string","null"]},"trigger_conditions":{"type":"array","uniqueItems":true,"items":{"type":"string","minLength":1}}}},"reconciliation":{"type":"object","additionalProperties":false,"required":["required","unknown_completion_state","observer_operation_ids"],"properties":{"required":{"type":"boolean"},"unknown_completion_state":{"type":["string","null"]},"observer_operation_ids":{"type":"array","uniqueItems":true,"items":{"type":"string","minLength":1}}}},"release_gates":{"type":"object","additionalProperties":false,"required":["eval_pack_subjects","required_policy_subjects","policy_decision_digests","human_admit_required"],"properties":{"eval_pack_subjects":{"type":"array","minItems":1,"uniqueItems":true,"items":{"type":"string","minLength":1}},"required_policy_subjects":{"type":"array","minItems":1,"uniqueItems":true,"items":{"type":"string","minLength":1}},"policy_decision_digests":{"type":"array","minItems":1,"uniqueItems":true,"items":{"type":"string","pattern":"^[a-f0-9]{64}$"}},"human_admit_required":{"const":true}}},"workflow_digest":{"type":"string","pattern":"^[a-f0-9]{64}$"},"execution_authority":{"const":"NONE"},"production_admission":{"const":"HUMAN_ADMIT_REQUIRED"}}}
